
17:40:00.447934 IP bras-base-toroon213mw-grc-15-142-126-121-237.dsl.bell.ca.62978 > lamp-ubuntu-s-1vcpu-1gb-tor1-01.ssh: Flags [.], ack 175088, win 2048, options [nop,nop,TS val 2808958287 ecr 2334951335], length 0
17:40:00.527891 IP lamp-ubuntu-s-1vcpu-1gb-tor1-01.ssh > bras-base-toroon213mw-grc-15-142-126-121-237.dsl.bell.ca.62978: Flags [P.], seq 175088:175836, ack 245, win 501, options [nop,nop,TS val 2334951439 ecr 2808958287], length 748
17:40:00.562035 IP bras-base-toroon213mw-grc-15-142-126-121-237.dsl.bell.ca.62978 > lamp-ubuntu-s-1vcpu-1gb-tor1-01.ssh: Flags [.], ack 175836, win 2048, options [nop,nop,TS val 2808958391 ecr 2334951439], length 0
17:40:00.631881 IP lamp-ubuntu-s-1vcpu-1gb-tor1-01.ssh > bras-base-toroon213mw-grc-15-142-126-121-237.dsl.bell.ca.62978: Flags [P.], seq 175836:176320, ack 245, win 501, options [nop,nop,TS val 2334951543 ecr 2808958391], length 484
17:40:00.644842 IP bras-base-toroon213mw-grc-15-142-126-121-237.dsl.bell.ca.62978 > lamp-ubuntu-s-1vcpu-1gb-tor1-01.ssh: Flags [.], ack 176320, win 2048, options [nop,nop,TS val 2808958495 ecr 2334951543], length 0
17:40:00.735853 IP lamp-ubuntu-s-1vcpu-1gb-tor1-01.ssh > bras-base-toroon213mw-grc-15-142-126-121-237.dsl.bell.ca.62978: Flags [P.], seq 176320:176804, ack 245, win 501, options [nop,nop,TS val 2334951647 ecr 2808958495], length 484
17:40:00.745380 IP bras-base-toroon213mw-grc-15-142-126-121-237.dsl.bell.ca.62978 > lamp-ubuntu-s-1vcpu-1gb-tor1-01.ssh: Flags [.], ack 176804, win 2048, options [nop,nop,TS val 2808958599 ecr 2334951647], length 0
17:40:00.839892 IP lamp-ubuntu-s-1vcpu-1gb-tor1-01.ssh > bras-base-toroon213mw-grc-15-142-126-121-237.dsl.bell.ca.62978: Flags [P.], seq 176804:177288, ack 245, win 501, options [nop,nop,TS val 2334951751 ecr 2808958599], length 484
17:40:00.847342 IP bras-base-toroon213mw-grc-15-142-126-121-237.dsl.bell.ca.62978 > lamp-ubuntu-s-1vcpu-1gb-tor1-01.ssh: Flags [.], ack 177288, win 2048, options [nop,nop,TS val 2808958705 ecr 2334951751], length 0
17:40:00.943925 IP lamp-ubuntu-s-1vcpu-1gb-tor1-01.ssh > bras-base-toroon213mw-grc-15-142-126-121-237.dsl.bell.ca.62978: Flags [P.], seq 177288:177772, ack 245, win 501, options [nop,nop,TS val 2334951855 ecr 2808958705], length 484
17:40:00.954086 IP bras-base-toroon213mw-grc-15-142-126-121-237.dsl.bell.ca.62978 > lamp-ubuntu-s-1vcpu-1gb-tor1-01.ssh: Flags [.], ack 177772, win 2048, options [nop,nop,TS val 2808958811 ecr 2334951855], length 0
17:40:01.047911 IP lamp-ubuntu-s-1vcpu-1gb-tor1-01.ssh > bras-base-toroon213mw-grc-15-142-126-121-237.dsl.bell.ca.62978: Flags [P.], seq 177772:178256, ack 245, win 501, options [nop,nop,TS val 2334951959 ecr 2808958811], length 484
17:40:01.053685 IP bras-base-toroon213mw-grc-15-142-126-121-237.dsl.bell.ca.62978 > lamp-ubuntu-s-1vcpu-1gb-tor1-01.ssh: Flags [.], ack 178256, win 2048, options [nop,nop,TS val 2808958911 ecr 2334951959], length 0
17:40:01.151937 IP lamp-ubuntu-s-1vcpu-1gb-tor1-01.ssh > bras-base-toroon213mw-grc-15-142-126-121-237.dsl.bell.ca.62978: Flags [P.], seq 178256:178740, ack 245, win 501, options [nop,nop,TS val 2334952063 ecr 2808958911], length 484
17:40:01.159166 IP bras-base-toroon213mw-grc-15-142-126-121-237.dsl.bell.ca.62978 > lamp-ubuntu-s-1vcpu-1gb-tor1-01.ssh: Flags [.], ack 178740, win 2048, options [nop,nop,TS val 2808959015 ecr 2334952063], length 0
17:40:01.255922 IP lamp-ubuntu-s-1vcpu-1gb-tor1-01.ssh > bras-base-toroon213mw-grc-15-142-126-121-237.dsl.bell.ca.62978: Flags [P.], seq 178740:179224, ack 245, win 501, options [nop,nop,TS val 2334952167 ecr 2808959015], length 484
17:40:01.263840 IP bras-base-toroon213mw-grc-15-142-126-121-237.dsl.bell.ca.62978 > lamp-ubuntu-s-1vcpu-1gb-tor1-01.ssh: Flags [.], ack 179224, win 2048, options [nop,nop,TS val 2808959119 ecr 2334952167], length 0
17:40:01.359882 IP lamp-ubuntu-s-1vcpu-1gb-tor1-01.ssh > bras-base-toroon213mw-grc-15-142-126-121-237.dsl.bell.ca.62978: Flags [P.], seq 179224:179708, ack 245, win 501, options [nop,nop,TS val 2334952271 ecr 2808959119], length 484
17:40:01.366132 IP bras-base-toroon213mw-grc-15-142-126-121-237.dsl.bell.ca.62978 > lamp-ubuntu-s-1vcpu-1gb-tor1-01.ssh: Flags [.], ack 179708, win 2048, options [nop,nop,TS val 2808959223 ecr 2334952271], length 0

